id;was;wer;geburtsdatum_und_geburtsort;sterbedatum_und_sterbeort;postleitzahl;strasse;hausnummer;standort;ortsteil;erstellt;art;foto_1;foto_2;foto_3;foto_4;tafeltext
196;Besuch des amerikanischen Bürgerrechtlers Dr. Martin Luther King am 13.09.1964;"Martin Luther King, Dr.; Baptistenpastor und amerikanischer Bürgerrechtler";15.01.1929, Atlanta;04.04.1968, Memphis, Tennessee;10117;Albrechtstraße;8;Rechts an der Hausecke zur Marienstraße;Mitte;;Acrylglastafel;/ba-mitte/_assets/gedenktafeln/id-196_luther-king-martin.jpg;;;;/kunst-und-kultur-mitte/geschichte/erinnerungskultur/gedenktafel-datenbank/id-196_martin-luther-king.pdf
763;"Besuch des französischen Staatspräsidenten; 750 Jahre Berlin";;;;10785;Derfflingerstraße;7;Französisches Gymnasium;Tiergarten;1987;;;;;;
769;Botschaft des Königreichs Norwegen;;;;10787;Rauchstraße;11;Rechter Pfosten Gartentor;Tiergarten;;Emaille-Infotafel;/ba-mitte/_assets/gedenktafeln/id-769_norwegisches-botschaftsbuero.jpg;;;;/kunst-und-kultur-mitte/geschichte/erinnerungskultur/gedenktafel-datenbank/id-769_norwegisches-botschaftsbuero.pdf
58;Brandenburger Tor (1789-1989);;;;10117;Platz des 18. März;;Früher Platz vor dem Brandenburger Tor, links vorm Tor;Mitte;22.12.2000;Infokasten;/ba-mitte/_assets/gedenktafeln/id-58_brandenburger-tor_1.jpg;/ba-mitte/_assets/gedenktafeln/id-58_brandenburger-tor_2.jpg;;;
643;Bunkeranlage Volkspark Humboldthain;;;;13357;Humboldthain;;Humboldthöhe, Wand zwischen den Freitreppen des Plateaus;Gesundbrunnen;Feb 90;Bronze-Infotafel;/ba-mitte/_assets/gedenktafeln/id-643_humboldthain-bunkeranlagen.jpg;;;;/kunst-und-kultur-mitte/geschichte/erinnerungskultur/gedenktafel-datenbank/id-643_bunker-humboldthain.pdf
773;Canisius-Kolleg;;;;10785;Tiergartenstraße;30 bis 31;Am Rande der Straße;Tiergarten;;Edelstahlstele;/ba-mitte/_assets/gedenktafeln/id-773_canisius-kolleg.jpg;;;;/kunst-und-kultur-mitte/geschichte/erinnerungskultur/gedenktafel-datenbank/id-773_canisius-kolleg.pdf
396;Delitzsch-Denkmal;"Herman Schulze-Delitzsch; Sozialreformer, Jurist und Politiker; Gründer der Genossenschaftsbewegung";29.08.1808, Delitzsch;29.04.1883, Potsdam;10179;Schulze-Delitzsch-Platz;;Am Denkmalsockel;Mitte;06.05.1992;Bronzetafel;;;;;/kunst-und-kultur-mitte/geschichte/erinnerungskultur/gedenktafel-datenbank/id-396_delitzsch.pdf
776;Den Opfern von Intoleranz, Terror und Krieg;;;;10785;Derfflingerstraße;7;Französisches Gymnasium, Eingangsbereich links hinter der Pförtnerloge;Tiergarten;1986;Bronzetafel;/ba-mitte/_assets/gedenktafeln/id-776_den-opfern-von-intoleranz-terror-und-krieg.jpg;;;;/kunst-und-kultur-mitte/geschichte/erinnerungskultur/gedenktafel-datenbank/id-776_collegianerverein.pdf
537;Den unbekannten Opfern an der Berliner Mauer;;;;10557;Spreeplatz vor dem Paul-Löbe-Haus;;Platzseite;Tiergarten;17.06.2003;Mauerkreuz;/ba-mitte/_assets/gedenktafeln/id-537_den-unbekannten-opfern-an-der-mauer.jpg;;;;/kunst-und-kultur-mitte/geschichte/erinnerungskultur/gedenktafel-datenbank/id-537_den-unbekannten-opfern.pdf
746;Den Verfolgten 1933-1945;;;;13353;Augustenburger Platz;1;Campus Rudolf Virchow, Mittelallee ganz am Ende;Wedding;;Bronzetafel am Skulptursockel;/ba-mitte/_assets/gedenktafeln/id-746_den-verfolgten-von-1933-1945.jpg;;;;/kunst-und-kultur-mitte/geschichte/erinnerungskultur/gedenktafel-datenbank/id-746_den-verfolgten.pdf
680;Denkmal Judenverfolgung und Deportationen;;;;10555;Levetzowstraße;7 bis 8;An der Mauer Ecke Jagowstraße;Moabit;1987;Bronzetafel;/ba-mitte/_assets/gedenktafeln/id-680_deportation_levetzowstr.jpg;;;;/kunst-und-kultur-mitte/geschichte/erinnerungskultur/gedenktafel-datenbank/id-680_synagoge-deportation.pdf
618;Denkmalsockel Karl Liebknecht;"Karl Liebknecht; Rechtsanwalt; Politiker; Mitbegründer Spartakusbund und KPD";13.08.1871, Leipzig;15.01.1919, Berlin;10785;Potsdamer Platz;10;Denkmal nicht vollendet, Grundstein 1995 entfernt, 2002 erneut aufgestellt;Tiergarten;2002;Grundstein eines Denkmals mit roter Inschrift;/ba-mitte/_assets/gedenktafeln/id-618_grundstein-liebknecht.jpg;;;;/kunst-und-kultur-mitte/geschichte/erinnerungskultur/gedenktafel-datenbank/id-618_grundstein-denkmal-liebknecht.pdf
515;Deportationsmahnmal Putlitzstraße;;;;10551;Putlitzbrücke;;Neben dem Denkmal am Geländer;Moabit;Mrz 93;Edelstahltafel;/ba-mitte/_assets/gedenktafeln/id-515_mahnmal-putlitzstrasse.jpg;;;;/kunst-und-kultur-mitte/geschichte/erinnerungskultur/gedenktafel-datenbank/id-515_mahnmal-putlitzstrasse.pdf
778;"Deutsch-Französicher Freundschaftsvertrag (Elysée-Vertrag); 22.01.1963 Paris";;;;10785;Klingelhöferstraße;;Klingelhöferstraße Ecke Tiergartenstraße, am Gehweg;Tiergarten;23.01.2003;Bronzetafel auf Beton;/ba-mitte/_assets/gedenktafeln/id-778_deutsch-franzoesischer-freundschaftsvertrag.jpg;;;;/kunst-und-kultur-mitte/geschichte/erinnerungskultur/gedenktafel-datenbank/id-778_freundschaftsvertrag.pdf
598;Dorotheenstadt;;;;10117;Dorotheenstraße;;Dorotheenstraße Ecke Am Kupfergraben, am Straßenrand;Mitte;;Infokasten;/ba-mitte/_assets/gedenktafeln/id-598_dorotheenstadt.jpg;;;;/kunst-und-kultur-mitte/geschichte/erinnerungskultur/gedenktafel-datenbank/id-598_dorotheenstadt.pdf
377;Ein Meter;;;;10178;Rathausstraße;15;Rechts vom Tor Spandauer Straße neben der Treppe;Mitte;;Metalltafel;;;;;
288;Eiserne Brücke;;;;10178;Bodestraße;3;Spreekanal, Brüstung der Brücke;Mitte;1916;Schwarze Inschrift in Stein - Infotext;/ba-mitte/_assets/gedenktafeln/id-288_eiserne-bruecke.jpg;;;;/kunst-und-kultur-mitte/geschichte/erinnerungskultur/gedenktafel-datenbank/id-288_eiserne-bruecke.pdf
780;"Elizabeth II.; Besuch in Berlin am 27.05.1987";;;;10787;Olof-Palme-Platz;;Brüstung Pflanzenbeet zur Budapester Straße;Tiergarten;1987;Bronzetafel;/ba-mitte/_assets/gedenktafeln/id-780_elisabeth-ii.jpg;;;;/kunst-und-kultur-mitte/geschichte/erinnerungskultur/gedenktafel-datenbank/id-780_besuch-elizabeth-ii.pdf
498;Enteignung jüdischer Bürger durch die Vermögensverwertungsstelle;;;;10557;Elisabeth-Abegg-Straße;1;"Vormals Alt-Moabit 143-145; jetzt am Straßenrand rechts neben Feuerwache";Moabit;Jun 01;KPM - Berliner Gedenktafel;/ba-mitte/_assets/gedenktafeln/id-498_enteignung-juedischer-buerger.jpg;;;;/kunst-und-kultur-mitte/geschichte/erinnerungskultur/gedenktafel-datenbank/id-498_vermoegensverwertungsstelle.pdf
364;Ephraim-Palais;;;;10178;Poststraße;16;Rechts der Treppe vor dem Haus;Mitte;19.05.1987;Bronzetafel;;;;;/kunst-und-kultur-mitte/geschichte/erinnerungskultur/gedenktafel-datenbank/id-364_ephraim-palais.pdf
673;Erinnerung an das Gotteshaus des Synagogenvereins Moabit und Hansabezirk;;;;10555;Lessingstraße;6;Im Vorgarten Ecke Flensburger Straße;Hansaviertel;;Bronzetafel;/ba-mitte/_assets/gedenktafeln/id-673_synagogenverein-moabit.jpg;;;;/kunst-und-kultur-mitte/geschichte/erinnerungskultur/gedenktafel-datenbank/id-673_synagogenverein-moabit.pdf
8;Erinnerung an geheimes Treffen von Vertretern der SPD und KPD am 22.06.1944;Julius Leber, Adolf Reichwein, Franz Jacob, Anton Saefkow, Ferdinand Thomas;;;10179;Köpenicker Straße;76;Köpenicker Straße Ecke Brückenstraße, an der Brandmauer, rechts vom U-Bahneingang;Mitte;19.07.1995;Eisengusstafel;/ba-mitte/_assets/gedenktafeln/id-8_treffen-spd-kpd.jpg;;;;/kunst-und-kultur-mitte/geschichte/erinnerungskultur/gedenktafel-datenbank/id-8_spd-kpd-1944.pdf
246;Erinnerung an Ständige Vertretung der Bundesrepublik bei der DDR (1974-1990);;;;10115;Hannoversche Straße;30;Am Haus zwischen 2 Fenstern;Mitte;Jun 11;Messingtafel mit schwarzer Inschrift;/ba-mitte/_assets/gedenktafeln/id-246_staendige-vertretung.jpg;;;;/kunst-und-kultur-mitte/geschichte/erinnerungskultur/gedenktafel-datenbank/id-246_staendige-vertretung.pdf
522;Ermordete Widerstandskämpfer des 20. Juli 1944;;;;10785;Stauffenbergstraße;13 bis 14;Im Hof links an der Wand;Tiergarten;15.11.2001;Bronzetafel;/ba-mitte/_assets/gedenktafeln/id-522_widerstandskaempfer-des-20-juli-1944.jpg;;;;/kunst-und-kultur-mitte/geschichte/erinnerungskultur/gedenktafel-datenbank/id-522_widerstandskaempfer-20-juli.pdf
257;Ermordung der kommunistischen Politiker Rosa Luxemburg und Karl Liebknecht;"Rosa Luxemburg, Politikerin; Karl Liebknecht, Rechtsanwalt und Politiker";"05.03.1871, Zamosc, Polen; 13.08.1871, Leipzig";"15.01.1919, Berlin; 15.01.1919, Berlin";10787;Katharina-Heinroth-Ufer;;Unterhalb der Liechtensteinbrücke links an der Wand;Tiergarten;1987;Bronzetafel;/ba-mitte/_assets/gedenktafeln/id-257_ermordung-luxemburg-und-liebknecht.jpg;;;;/kunst-und-kultur-mitte/geschichte/erinnerungskultur/gedenktafel-datenbank/id-257_ermordung-luxemburg-liebknecht.pdf
528;Errichtung Gedenkstätte Berliner Mauer;;;;10115;Bernauer Straße;2;Bernauer Straße Ecke Ackerstraße, vor dem Eingang zur Gedenkstätte;Mitte;;Inschrift in der Metallwand;/ba-mitte/_assets/gedenktafeln/id-528_gedenkstaette-berliner-mauer.jpg;;;;/kunst-und-kultur-mitte/geschichte/erinnerungskultur/gedenktafel-datenbank/id-528_gedenkstaette-berliner-mauer.pdf
384;Errichtung gemeinnützige Augen-Heilanstalt;"Julius Hirschberg; Augenarzt, Hochschullehrer und Medizinhistoriker; ""Hirschberg-Test""";18.09.1843, Potsdam;17.02.1925, Berlin;10117;Reinhardtstraße;34;Zwischen dem 1. und 2. Fenster links vom Eingang;Mitte;25.09.1999;Bronzetafel;/ba-mitte/_assets/gedenktafeln/id-384_hirschberg-julius.jpg;;;;/kunst-und-kultur-mitte/geschichte/erinnerungskultur/gedenktafel-datenbank/id-384_julius-hirschberg.pdf
7;Erste Berliner Volksbadeanstalt (1880);"James Henry Simon; Unternehmer und Förderer der Museen";17.09.1851, Berlin;23.05.1932, Berlin;10115;Gartenstraße;5;Stadtbad, rechts vom Eingang;Mitte;08.06.1995;KPM - Berliner Gedenktafel;/ba-mitte/_assets/gedenktafeln/id-7_simon-james-henry.jpg;;;;/kunst-und-kultur-mitte/geschichte/erinnerungskultur/gedenktafel-datenbank/id-7_simon-james-henry.pdf
65;Erste Blindenschule Preußens (gegr. 13.10.1806);"Johann August Zeune; Pädagoge, Geograph und Germanist";12.05.1778, Wittenberg;14.11.1853, Berlin;10119;Gipsstraße;11;Links vom Eingang;Mitte;13.10.2001;Bronzetafel;/ba-mitte/_assets/gedenktafeln/id-65_zeune-johann-august.jpg;;;;/kunst-und-kultur-mitte/geschichte/erinnerungskultur/gedenktafel-datenbank/id-65_zeune.pdf
217;Erste Homosexuelle Emanzipationsbewegung;"Magnus Hirschfeld, Dr.; Karl Heinrich Ulrichs; Anita Augspurg";;;10557;Magnus-Hirschfeld-Ufer;;Uferpromenade;Moabit;02.09.2011;2 Metall-Infostelen;/ba-mitte/_assets/gedenktafeln/id-217_homosexuelle-emanzipationsbewegung_1.jpg;/ba-mitte/_assets/gedenktafeln/id-217_homosexuelle-emanzipationsbewegung_2.jpg;/ba-mitte/_assets/gedenktafeln/id-217_homosexuelle-emanzipationsbewegung_3.jpg;/ba-mitte/_assets/gedenktafeln/id-217_homosexuelle-emanzipationsbewegung_4.jpg;/kunst-und-kultur-mitte/geschichte/erinnerungskultur/gedenktafel-datenbank/id-217_homosexuelle-emanzipationsbewegung.pdf
373;Erste Sitzung der Stadtverordneten-Versammlung am 06.01.1870;;;;10178;Rathausstraße;15;Eingang Jüdenstraße, im Innenhof unterhalb der 1. Etage;Mitte;06.01.1870;Bronzetafel;;;;;/kunst-und-kultur-mitte/geschichte/erinnerungskultur/gedenktafel-datenbank/id-373_erste-sitzung-stadtverordnete.pdf
374;Erste Sitzung des Deutschen Reichstages am 17.04.1871;;;;10178;Rathausstraße;15;Eingang Jüdenstraße, im Innenhof unterhalb der 1. Etage;Mitte;17.04.1871;Bronzetafel;;;;;/kunst-und-kultur-mitte/geschichte/erinnerungskultur/gedenktafel-datenbank/id-374_erste-reichstagsversammlung.pdf
372;Erste Sitzung des Magistrats am 30.06.1865;;;;10178;Rathausstraße;15;Eingang Jüdenstraße, im Innenhof unterhalb der 1. Etage;Mitte;30.06.1865;Bronzetafel;;;;;/kunst-und-kultur-mitte/geschichte/erinnerungskultur/gedenktafel-datenbank/id-372_erste-magistratssitzung.pdf
203;"Erstes Altenheim der Jüdischen Gemeinde zu Berlin; ab 1942 Gestapo-Sammellager für Juden";;;;10115;Große Hamburger Straße;26;Mit Magen David (Davidstern) am Mauersockel;Mitte;;Bronzetafel;/ba-mitte/_assets/gedenktafeln/id-203_erstes-altenheim-der-juedischen-gemeinde_1.jpg;/ba-mitte/_assets/gedenktafeln/id-203_erstes-altenheim-der-juedischen-gemeinde_2.jpg;;;/kunst-und-kultur-mitte/geschichte/erinnerungskultur/gedenktafel-datenbank/id-203_erstes-altenheim-der-juedischen-gemeinde.pdf
614;"Erstes öffentliches Elektrizitätskraftwerk; 15.08.1885";;;;10117;Markgrafenstraße;35;Links vom Eingang;Mitte;01.09.1997;Eisengusstafel;/ba-mitte/_assets/gedenktafeln/id-614_erstes-oeffentliches-kraftwerk.jpg;;;;/kunst-und-kultur-mitte/geschichte/erinnerungskultur/gedenktafel-datenbank/id-614_erstes-kraftwerk.pdf
154;Evangelisches Johannesstift;"Johann Hinrich Wichern; Theologe; Gründer der ""Inneren Mission""; Gefängnisreformer";21.04.1808, Hamburg;07.04.1881, Hamburg;10785;Magdeburger Platz;;Links neben dem Eingang;Tiergarten;01.11.1989;KPM - Berliner Gedenktafel;/ba-mitte/_assets/gedenktafeln/id-154_wichern-johann-hinrich.jpg;;;;/kunst-und-kultur-mitte/geschichte/erinnerungskultur/gedenktafel-datenbank/id-154_wichern.pdf
697;Fabrikationshallen der Ludwig Loewe & Co.;"Ludwig Loewe; Unternehmer; Fabrikant; linksliberaler Politiker; MdR";27.11.1837, Heiligenstadt;11.09.1886, Berlin;10553;Huttenstraße;17 bis 20;Vor der Halle Ecke Wiebestraße (Haltestelle M27);Moabit;Sep 55;2 Metalltafeln mit schwarzer Inschrift und Grafik;/ba-mitte/_assets/gedenktafeln/id-697_loewe-ludwig-u-co.jpg;;;;/kunst-und-kultur-mitte/geschichte/erinnerungskultur/gedenktafel-datenbank/id-697_ludwig-loewe.pdf
55;"Familienschule der ""Hilfsstelle für evangelische Rasseverfolgte"" (Büro Pfarrer Gruber)";;;;10178;Oranienburger Straße;20;Zwischen dem 1. und 2. Fenster links der Einfahrt;Mitte;14.10.2000;Bronzetafel;/ba-mitte/_assets/gedenktafeln/id-55_familienschule.jpg;;;;/kunst-und-kultur-mitte/geschichte/erinnerungskultur/gedenktafel-datenbank/id-55_familienschule.pdf
599;"Feldherrendenkmale; in der Straße Unter den Linden";;;;10117;Unter den Linden;;Rasenfläche rechts vom Opernpalais;Mitte;2002;Metall-Infotafel;/ba-mitte/_assets/gedenktafeln/id-599_feldherrendenkmale.jpg;;;;/kunst-und-kultur-mitte/geschichte/erinnerungskultur/gedenktafel-datenbank/id-599_feldherrendenkmale.pdf
218;"Fluchttunnel 29; 14.09.1962 und 15.09.1962";;;;10115;Schönholzer Straße;7;Links vom Eingang;Mitte;14.09.2009;Bronze-Infotafel;/ba-mitte/_assets/gedenktafeln/id-218_fluchttunnel-29.jpg;;;;/kunst-und-kultur-mitte/geschichte/erinnerungskultur/gedenktafel-datenbank/id-218_tunnel-29.pdf
192;Fluchttunnel 57;"Wolfgang Fuchs; Optiker und Drogist; Fluchthelfer";08.01.1939, Jena;07.06.2001, Berlin;13355;Bernauer Straße;97;Rechte Wand vor Hauseingang;Gesundbrunnen;Okt 11;Bronzetafel;/ba-mitte/_assets/gedenktafeln/id-192_fluchttunnel-57.jpg;;;;/kunst-und-kultur-mitte/geschichte/erinnerungskultur/gedenktafel-datenbank/id-192_fluchttunnel-57.pdf
601;"Fluchttunnel; Schießerei nach geglückter Flucht";"Egon Schultz; DDR-Grenzsoldat";04.01.1943, Groß-Jestin;05.10.1964, Berlin;10115;Strelitzer Straße;55;Rechts vom Eingang;Mitte;2004;Bronzetafel;/ba-mitte/_assets/gedenktafeln/id-601_fluchttunnel_egon-schultz.jpg;;;;/kunst-und-kultur-mitte/geschichte/erinnerungskultur/gedenktafel-datenbank/id-601_fluchttunnel-strelitzer.pdf
330;Förderer des Museums für Naturkunde;;;;10115;Invalidenstraße;43;Im Dinosaal hinten links und rechts an der Wand;Mitte;;Steintafel;;;;;/kunst-und-kultur-mitte/geschichte/erinnerungskultur/gedenktafel-datenbank/id-330_foerderer-naturkundemuseum.pdf
682;Förderin des SOS-Kinderdorfes;"Ingeborg Bergemann; Mäzenin";;;10551;Waldstraße;23 bis 24;Im Eingangsbereich;Moabit;;Acrylglastafel;/ba-mitte/_assets/gedenktafeln/id-682_ingeborg-bachmann.jpg;;;;/kunst-und-kultur-mitte/geschichte/erinnerungskultur/gedenktafel-datenbank/id-682_bergemann.pdf
341;Franziskaner Klosterkirche;"Friedrich Ludwig Jahn; Pädagoge und Initiator der deutschen Turnbewegung; ""Turnvater Jahn""";11.08.1778, Lanz;"15.10.1852; Freyburg (Unstrut)";10179;Klosterstraße;73;Links vom Eingang;Mitte;;Bronzetafel;/ba-mitte/_assets/gedenktafeln/id-341_ruine-klosterkirche.jpg;;;;/kunst-und-kultur-mitte/geschichte/erinnerungskultur/gedenktafel-datenbank/id-341_klosterkirche.pdf
308;Französische Friedrichstadtkirche;;;;10117;Gendarmenmarkt;7;Am Französischen Dom zur Markgrafenstraße;Mitte;17.04.1983;Eisengusstafel;/ba-mitte/_assets/gedenktafeln/id-308_franzoesische-friedrichstadtkirche.jpg;;;;/kunst-und-kultur-mitte/geschichte/erinnerungskultur/gedenktafel-datenbank/id-308_franzoesische-friedrichstadtkirche.pdf
489;Französischen Botschaft;;;;10117;Pariser Platz;5;Hauptzugang Wilhelmstraße 69;Mitte;23.01.2003;Acrylglastafel;;;;;/kunst-und-kultur-mitte/geschichte/erinnerungskultur/gedenktafel-datenbank/id-489_französische-botschaft.pdf
302;Französisches Hospital anlässlich des Edikts von Potsdam 29.10.1686;;;;10117;Claire-Waldoff-Straße;10;Im Durchgang zum Hof links;Mitte;29.10.1994;Bronzetafel, rund;/ba-mitte/_assets/gedenktafeln/id-302_franzoesisches-hospital.jpg;;;;/kunst-und-kultur-mitte/geschichte/erinnerungskultur/gedenktafel-datenbank/id-302_franzoesisches-hospital.pdf
95;"Friedhof Wilsnacker Straße; Kriegsgräber";;;;10559;Wilsnacker Straße;;Gegenüber vom Amts-/Landsgericht Tiergarten, Rechts vom Friedhofseingang;Moabit;30.04.2005;Bronzetafel;/ba-mitte/_assets/gedenktafeln/id-95_kriegsgraeber.jpg;;;;/kunst-und-kultur-mitte/geschichte/erinnerungskultur/gedenktafel-datenbank/id-95_kriegsgraeber.pdf
227;Friedrich Wilhelm und Friedrich der Große zum Potsdamer Edikt von 1685;;;;10117;Gendarmenmarkt;7;Am Französischen Dom;Mitte;29.10.1935;Bronzetafel;/ba-mitte/_assets/gedenktafeln/id-227_potsdamer-edikt.jpg;;;;/kunst-und-kultur-mitte/geschichte/erinnerungskultur/gedenktafel-datenbank/id-227_potsdamer-edikt.pdf
351;Friedrichs-Hospital;;;;10179;Littenstraße;109;Im Treppenhaus 1. Etage;Mitte;1909;Bronze-Infotafel;/ba-mitte/_assets/gedenktafeln/id-351_friedrichs-hospital.jpg;;;;/kunst-und-kultur-mitte/geschichte/erinnerungskultur/gedenktafel-datenbank/id-351_friedrichs-hospital.pdf
426;Friedrichs-Werdersche Kirche;;;;10117;Werderscher Markt;;Links neben dem Eingang;Mitte;15.09.1987;Bronze-Infotafel;/ba-mitte/_assets/gedenktafeln/id-426_friedrichs-werdersche-kirche.jpg;;;;/kunst-und-kultur-mitte/geschichte/erinnerungskultur/gedenktafel-datenbank/id-426_friedrichs-werdersche-kirche.pdf
235;"Gaststätte ""Zum Nussbaum""";;;;10178;Am Nussbaum;3;Am Nussbaum Ecke Probststraße, rechts am Haus 3 um die Ecke;Mitte;09.10.1987;Bronzetafel;/ba-mitte/_assets/gedenktafeln/id-235_zum-nussbaum.jpg;;;;/kunst-und-kultur-mitte/geschichte/erinnerungskultur/gedenktafel-datenbank/id-235_nussbaum.pdf
271;Gebäude der Singakademie;;;;10117;Am Festungsgraben;2;Im Foyer am Pfeiler zwischen den Ausgangstüren;Mitte;27.05.1991;Bronzetafel;/ba-mitte/_assets/gedenktafeln/id-271_geschichte-des-gebaeudes_singakademie.jpg;;;;/kunst-und-kultur-mitte/geschichte/erinnerungskultur/gedenktafel-datenbank/id-271_singakademie.pdf
81;"Gebrüder Weinberger; Lebensmittelgroßhandlung";;;;10115;Bergstraße;68 bis 70;Ganz rechts an Nr. 70;Mitte;03.09.2003;Bronzetafel unter Glas;/ba-mitte/_assets/gedenktafeln/id-81_weinberger.jpg;;;;/kunst-und-kultur-mitte/geschichte/erinnerungskultur/gedenktafel-datenbank/id-81_weinberger.pdf
742;Geburtshaus;"Otto Nagel; Maler; Präsident der Akademie der Künste der DDR";27.09.1894, Berlin;12.07.1967, Berlin;13347;Reinickendorfer Straße;67;Rechts vom Eingang, zwischen dem 1. und 2. Fenster;Wedding;1974;Bronzetafel;/ba-mitte/_assets/gedenktafeln/id-742_otto-nagel.jpg;;;;/kunst-und-kultur-mitte/geschichte/erinnerungskultur/gedenktafel-datenbank/id-742_otto-nagel.pdf
538;Gedenkkreuz für Todesopfer an der Berliner Mauer;"Günter Litfin; Schneider";19.01.1937, Berlin;24.08.1961, Berlin;10557;Spreeplatz vor dem Paul-Löbe-Haus;;Platzseite;Tiergarten;17.06.2003;Mauerkreuz;/ba-mitte/_assets/gedenktafeln/id-538_litfin-guenter.jpg;;;;/kunst-und-kultur-mitte/geschichte/erinnerungskultur/gedenktafel-datenbank/id-538_litfin.pdf
539;Gedenkkreuz für Todesopfer an der Berliner Mauer;"Udo Düllick; Ingenieur";08.03.1936, Werder;05.10.1961, Berlin;10557;Spreeplatz vor dem Paul-Löbe-Haus;;Spreeseite;Tiergarten;17.06.2003;Mauerkreuz;/ba-mitte/_assets/gedenktafeln/id-539_duellick-udo.jpg;;;;/kunst-und-kultur-mitte/geschichte/erinnerungskultur/gedenktafel-datenbank/id-539_duellick.pdf
540;Gedenkkreuz für Todesopfer an der Berliner Mauer;"Werner Probst; Kraftfahrer";18.06.1936, Berlin;14.10.1961, Berlin;10557;Spreeplatz vor dem Paul-Löbe-Haus;;Spreeseite;Tiergarten;17.06.2003;Mauerkreuz;/ba-mitte/_assets/gedenktafeln/id-540_probst-werner.jpg;;;;/kunst-und-kultur-mitte/geschichte/erinnerungskultur/gedenktafel-datenbank/id-540_probst.pdf
541;Gedenkkreuz für Todesopfer an der Berliner Mauer;"Ingo Krüger; Koch";31.01.1940, Berlin;11.12.1961, Berlin;10557;Spreeplatz vor dem Paul-Löbe-Haus;;Spreeseite;Tiergarten;17.06.2003;Mauerkreuz;/ba-mitte/_assets/gedenktafeln/id-541_krueger-ingo.jpg;;;;/kunst-und-kultur-mitte/geschichte/erinnerungskultur/gedenktafel-datenbank/id-541_krueger.pdf
542;Gedenkkreuz für Todesopfer an der Berliner Mauer;"Philipp Held; Elektriker";02.05.1942, Worms;April 1962, Berlin;10557;Spreeplatz vor dem Paul-Löbe-Haus;;Spreeseite;Tiergarten;17.06.2003;Mauerkreuz;/ba-mitte/_assets/gedenktafeln/id-542_held-philipp.jpg;;;;/kunst-und-kultur-mitte/geschichte/erinnerungskultur/gedenktafel-datenbank/id-542_held.pdf
543;Gedenkkreuz für Todesopfer an der Berliner Mauer;"Axel Hannemann; Lehrling";27.04.1945, Buchhain;05.06.1962, Berlin;10557;Spreeplatz vor dem Paul-Löbe-Haus;;Spreeseite;Tiergarten;17.06.2003;Mauerkreuz;/ba-mitte/_assets/gedenktafeln/id-543_hannemann-axel.jpg;;;;/kunst-und-kultur-mitte/geschichte/erinnerungskultur/gedenktafel-datenbank/id-543_hannemann.pdf
544;Gedenkkreuz für Todesopfer an der Berliner Mauer;"Lutz Haberlandt; Maurer";29.04.1938, Berlin;27.05.1962, Berlin;10557;Spreeplatz vor dem Paul-Löbe-Haus;;Spreeseite;Tiergarten;17.06.2003;Mauerkreuz;/ba-mitte/_assets/gedenktafeln/id-544_haberland-lutz.jpg;;;;/kunst-und-kultur-mitte/geschichte/erinnerungskultur/gedenktafel-datenbank/id-544_haberland.pdf
545;Gedenkkreuz für Todesopfer an der Berliner Mauer;"Hans Räwel; Bäcker";11.12.1941, Stralsund;01.01.1963, Berlin;10557;Spreeplatz vor dem Paul-Löbe-Haus;;Platzseite;Tiergarten;17.06.2003;Mauerkreuz;/ba-mitte/_assets/gedenktafeln/id-545_raewel-hans.jpg;;;;/kunst-und-kultur-mitte/geschichte/erinnerungskultur/gedenktafel-datenbank/id-545_raewel.pdf
546;Gedenkkreuz für Todesopfer an der Berliner Mauer;Wolf-Olaf Muszynski;01.02.1947, Berlin;März 1963, Berlin;10557;Spreeplatz vor dem Paul-Löbe-Haus;;Spreeseite;Tiergarten;17.06.2003;Mauerkreuz;/ba-mitte/_assets/gedenktafeln/id-546_muszinski-wolf-olaf.jpg;;;;/kunst-und-kultur-mitte/geschichte/erinnerungskultur/gedenktafel-datenbank/id-546_muszinski.pdf
547;Gedenkkreuz für Todesopfer an der Berliner Mauer;"Klaus Schröter; Elektroingenieur";21.02.1940, Friedersdorf;04.11.1963, Berlin;10557;Spreeplatz vor dem Paul-Löbe-Haus;;Platzseite;Tiergarten;17.06.2003;Mauerkreuz;/ba-mitte/_assets/gedenktafeln/id-547_schroeter-klaus.jpg;;;;/kunst-und-kultur-mitte/geschichte/erinnerungskultur/gedenktafel-datenbank/id-547_schroeter.pdf
548;Gedenkkreuz für Todesopfer an der Berliner Mauer;"Heinz Sokolowski; Fahrstuhlführer";17.12.1917, Frankfurt/Oder;25.11.1065, Berlin;10557;Spreeplatz vor dem Paul-Löbe-Haus;;Platzseite;Tiergarten;17.06.2003;Mauerkreuz;/ba-mitte/_assets/gedenktafeln/id-548_sokolowski-heinz.jpg;;;;/kunst-und-kultur-mitte/geschichte/erinnerungskultur/gedenktafel-datenbank/id-548_sokolowski.pdf
549;Gedenkkreuz für Todesopfer an der Berliner Mauer;"Marienetta Jirkowski; Textilfacharbeiterin";25.08.1962, Bad Saarow;22.11.1980, Hennigsdorf;10557;Spreeplatz vor dem Paul-Löbe-Haus;;Platzseite;Tiergarten;17.06.2003;Mauerkreuz;/ba-mitte/_assets/gedenktafeln/id-549_jirkowski-marinetta.jpg;;;;/kunst-und-kultur-mitte/geschichte/erinnerungskultur/gedenktafel-datenbank/id-549_jirkowski.pdf
550;Gedenkkreuz für Todesopfer an der Berliner Mauer;"Chris Gueffroy; Kellner";21.06.1968, Pasewalk;06.02.1989, Berlin;10557;Spreeplatz vor dem Paul-Löbe-Haus;;Spreeseite;Tiergarten;17.06.2003;Mauerkreuz;/ba-mitte/_assets/gedenktafeln/id-550_gueffroy-chris.jpg;;;;/kunst-und-kultur-mitte/geschichte/erinnerungskultur/gedenktafel-datenbank/id-550_gueffroy.pdf
691;Gedenkort Deportation von Juden vom Güterbahnhof Moabit;;;;10559;Quitzowstraße;18 bis 21;Auf dem Unterstreifen des Gehwegs zwischen Hellweg und Lidl;Moabit;19.01.2007;Metallstele;/ba-mitte/_assets/gedenktafeln/id-691_deportationen-moabit_1.jpg;/ba-mitte/_assets/gedenktafeln/id-691_deportationen-moabit_2.jpg;;;/kunst-und-kultur-mitte/geschichte/erinnerungskultur/gedenktafel-datenbank/id-691_deportationen-bhf-moabit.pdf
301;Gedenkplatte Kriegstote des Frühjahres 1945;;;;10115;Chausseestraße;126;Dorotheenstädtischer Friedhof ganz hinten;Mitte;50er;Bronze-Bodentafel;/ba-mitte/_assets/gedenktafeln/id-301_kriegsopfer-fruehjahr-1945.jpg;;;;/kunst-und-kultur-mitte/geschichte/erinnerungskultur/gedenktafel-datenbank/id-301_opfer-des-fruehjahres-1945.pdf
641;"Gedenkstein ""Blutmai"" 1929";;;;13357;Walter-Röber-Brücke;;Wiesenstraße, an der Panke, gegenüber Einmündung Uferstraße;Gesundbrunnen;;Findling mit schwarzer Inschrift;/ba-mitte/_assets/gedenktafeln/id-641_blutmai.jpg;;;;/kunst-und-kultur-mitte/geschichte/erinnerungskultur/gedenktafel-datenbank/id-641_blutmai.pdf
703;"Gedenkstein ""Den Notstandsarbeitern zum Dank""";"Alfred Frenkel; Bildhauer";;;10559;Fritz-Schloß-Park;;Gegenüber Einmündung der Turmstraße;Moabit;;Kalksteinquader;/ba-mitte/_assets/gedenktafeln/id-703_notstandsarbeiter_1.jpg;/ba-mitte/_assets/gedenktafeln/id-703_notstandsarbeiter_2.jpg;/ba-mitte/_assets/gedenktafeln/id-703_notstandsarbeiter_3.jpg;/ba-mitte/_assets/gedenktafeln/id-703_notstandsarbeiter_4.jpg;/kunst-und-kultur-mitte/geschichte/erinnerungskultur/gedenktafel-datenbank/id-703_notstandsarbeiter.pdf
