id;was;wer;geburtsdatum_und_geburtsort;sterbedatum_und_sterbeort;postleitzahl;strasse;hausnummer;standort;ortsteil;erstellt;art;foto_1;foto_2;foto_3;foto_4;tafeltext
512;;"Marlene Dietrich; Schauspielerin und Sängerin; NS-Gegnerin";27.12.1901, Schöneberg;06.05.1992, Paris;10785;Eichhornstraße;5 bis 6;Eichhornstraße Ecke Alte Potsdamer Straße, Marlene-Dietrichplatz vor dem Theater;Tiergarten;2000;Metalltafel mit schwarzer Inschrift;/ba-mitte/_assets/gedenktafeln/id-512_marlene-dietrich.jpg;;;;/kunst-und-kultur-mitte/geschichte/erinnerungskultur/gedenktafel-datenbank/id-512_marlene-dietrich.pdf
514;;"Otto Braun; Politiker; preußischer Ministerpräsident";28.01.1872, Königsberg;15.12.1955, Schweiz;10785;Potsdamer Straße;35;Staatsbibliothek, vor dem Otto-Braun-Saal;Tiergarten;;Kupfertafel mit schwarzer Inschrift;;;;;/kunst-und-kultur-mitte/geschichte/erinnerungskultur/gedenktafel-datenbank/id-514_braun-otto.pdf
4;;"Johannes Popitz; Politiker; Staatssekretär im Reichsfinanzministerium; NS-Widerstandskämpfer";02.12.1884, Leipzig;02.02.1945, Plötzensee;10117;Am Festungsgraben;1;Zwischen dem 2. und 3. Fenster links;Mitte;19.07.1994;KPM - Berliner Gedenktafel;/ba-mitte/_assets/gedenktafeln/id-4_johannes-popitz.jpg;;;;/kunst-und-kultur-mitte/geschichte/erinnerungskultur/gedenktafel-datenbank/id-4_popitz.pdf
517;;"Kurt Tucholsky; Journalist und Schriftsteller";09.01.1890, Berlin;21.12.1935, Hindas, Schweden;10553;Rostocker Straße;32 b;Vorraum zur Bücherei;Moabit;;Bronzetafel;/ba-mitte/_assets/gedenktafeln/id-517_tucholsky-kurt.jpg;;;;/kunst-und-kultur-mitte/geschichte/erinnerungskultur/gedenktafel-datenbank/id-517_tucholsky.pdf
6;;"Wilhelm Krützfeld; preußischer Polizeibeamter";09.12.1880, Hornsdorf;31.10.1953, Berlin;10178;Oranienburger Straße;30;Synagoge, zwischen 2 Fenstern, rechts der Synagoge;Mitte;05.05.1995;Bronzetafel;/ba-mitte/_assets/gedenktafeln/id-6_kruetzfeld-wilhelm.jpg;;;;/kunst-und-kultur-mitte/geschichte/erinnerungskultur/gedenktafel-datenbank/id-6_kruetzfeld-wilhelm.pdf
518;;"Kurt Tucholsky; Journalist und Schriftsteller";09.01.1890, Berlin;21.12.1935, Hindas, Schweden;10559;Lübecker Straße;13;Rechts vom Eingang (Geburtshaus);Moabit;;Bronzetafel;/ba-mitte/_assets/gedenktafeln/id-518_tucholsky-kurt.jpg;;;;/kunst-und-kultur-mitte/geschichte/erinnerungskultur/gedenktafel-datenbank/id-518_tucholsky.pdf
774;;"Carl Langhammer; Maler; VBK";26.07.1868, Berlin;1943, Berlin;10785;Schöneberger Ufer;57;Linker Vorgarten am Bürgersteig;Tiergarten;01.06.2007;Metalltafel mit schwarzer Inschrift;/ba-mitte/_assets/gedenktafeln/id-774_carl-langhammer.jpg;;;;/kunst-und-kultur-mitte/geschichte/erinnerungskultur/gedenktafel-datenbank/id-774_carl-langhammer.pdf
263;;"Ludwig Ferdinand Meyer, Prof. Dr. med.; jüdischer Kinderarzt";23.05.1879, Wiesbaden;1954, Jerusalem/Tel Aviv;13347;Reinickendorfer Straße;61;Haus 15, links neben dem Eingang des Verwaltungsgebäudes;Wedding;;Bronzetafel;/ba-mitte/_assets/gedenktafeln/id-263_ludwig-ferdinand-meyer.jpg;;;;/kunst-und-kultur-mitte/geschichte/erinnerungskultur/gedenktafel-datenbank/id-263_ludwig-ferdinand-meyer.pdf
519;;"Clara Grunwald; Lehrerin und Reformpädagogin; Gründerin von Montessori-Kinderheimen; NS-Verfolgte";11.06.1877, Mönchengladbach;04.1943, KZ Auschwitz-Birkenau;13347;Ruheplatzstraße;13;Ruheplatzstraße Ecke Schulstraße, links vom Eingang, Jugendamt;Wedding;31.10.1997;Bronzetafel;/ba-mitte/_assets/gedenktafeln/id-519_clara-grunwald.jpg;;;;/kunst-und-kultur-mitte/geschichte/erinnerungskultur/gedenktafel-datenbank/id-519_clara-grunwald.pdf
775;;"Constantin von Doppelmair (Doppelmeyer); russischer Militärattachè";unbekannt;27.10.1871;10787;Gartenufer am Landwehrkanal;;Am Weg, Zaun zum Zoo;Tiergarten;1872;Steinmedaillon;/ba-mitte/_assets/gedenktafeln/id-775_constatin-von-doppelmair.jpg;;;;/kunst-und-kultur-mitte/geschichte/erinnerungskultur/gedenktafel-datenbank/id-775_doppelmair.pdf
265;;"Krystana Janewa; bulgarische Kommunistin und NS-Widerstandskämpferin";30.10.1914;23.10.1944, Zuchthaus Halle/Saale;10117;Albrechtstraße;14;Zwischen dem 2. und 3. Fenster links;Mitte;1977;Metalltafel;/ba-mitte/_assets/gedenktafeln/id-265_krystana-iwanova-janewa.jpg;;;;/kunst-und-kultur-mitte/geschichte/erinnerungskultur/gedenktafel-datenbank/id-265_janewa.pdf
521;;"Selma Meerbaum-Eisinger; deutschsprachige jüdisch-ukrainische Dichterin";05.02.1924, Czernowitz, Ukraine;16.12.1942, Ukraine;10555;Siegmunds Hof;20;Im Meerbaumhaus;Hansaviertel;Mrz 87;2 Acrylglastafeln;/ba-mitte/_assets/gedenktafeln/id-521_selma-meerbaum-eisinger.jpg;;;;/kunst-und-kultur-mitte/geschichte/erinnerungskultur/gedenktafel-datenbank/id-521-selma-meerbaum.pdf
10;;"Bona Peiser;  Erste deutsche Bibliothekarin";26.04.1864, Berlin;17.03.1929, Berlin;10179;Rungestraße;25 bis 27;Zwischen dem 5. und 6. Fenster links der Einfahrt;Mitte;10.09.1995;Eisengusstafel;/ba-mitte/_assets/gedenktafeln/id-10_bona-peiser.jpg;;;;/kunst-und-kultur-mitte/geschichte/erinnerungskultur/gedenktafel-datenbank/id-10_bona-peiser.pdf
11;;"Walter Felsenstein; Regisseur; Gründer und Intendant der Komischen Oper";30.05.1901, Wien;08.10.1975, Berlin;10117;Behrenstraße;55 bis 57;Pfeiler am Eingang Komische Oper;Mitte;08.10.1995;KPM - Berliner Gedenktafel;/ba-mitte/_assets/gedenktafeln/id-11_walter-felsenstein.jpg;;;;/kunst-und-kultur-mitte/geschichte/erinnerungskultur/gedenktafel-datenbank/id-11_felsenstein-walter.pdf
12;;"Johann Peter Süßmilch; evangelischer Theologe, Statistiker und Demograph";03.09.1707, Berlin-Zehlendorf;22.03.1767, Berlin;10178;Brüderstraße;10;Zur Zeit im Haus. Noch nicht wieder angebracht;Mitte;18.10.1994;KPM - Berliner Gedenktafel;/ba-mitte/_assets/gedenktafeln/id-12_johann-peter-suessmilch.jpg;;;;/kunst-und-kultur-mitte/geschichte/erinnerungskultur/gedenktafel-datenbank/id-12_suessmilch-johann-peter.pdf
13;;"Martin Heinrich Klaproth; Apotheker und Chemiker; Entdecker des Elements Uran";01.12.1743, Wernigerode;01.01.1817, Berlin;10178;Spandauer Straße;25;Spandauer Straße Ecke Probststraße, Hofseite / Fassade zum Nikolaikirchplatz;Mitte;15.12.1995;KPM - Berliner Gedenktafel;/ba-mitte/_assets/gedenktafeln/id-13_klaproth-martin-heinrich.jpg;;;;/kunst-und-kultur-mitte/geschichte/erinnerungskultur/gedenktafel-datenbank/id-13_klaproth.pdf
269;;"Karl Reichsfreiherr vom und zum Stein; preußischer Reformer";26.10.1757, Nassau;29.06.1831, Cappenburg, Westfalen;10117;Am Festungsgraben;1;Zwischen dem 2. und 3. Fenster rechts;Mitte;;Bronzetafel;/ba-mitte/_assets/gedenktafeln/id-269_stein-vom-und-zum.jpg;;;;/kunst-und-kultur-mitte/geschichte/erinnerungskultur/gedenktafel-datenbank/id-269_stein.pdf
525;;"Max Josef Metzger; katholischer Priester; Pazifist; NS-Widerstandskämpfer; Förderer der Sprache Esperanto";03.02.1887, Schopfheim;17.04.1944, Zuchthaus Brandenburg;13353;Willdenowstraße;8;St. Josephskirche, links vom Eingang, zwischen dem 3. und 4. Fenster;Wedding;1994;Bronzetafel;/ba-mitte/_assets/gedenktafeln/id-525_max-josef-metzger.jpg;;;;/kunst-und-kultur-mitte/geschichte/erinnerungskultur/gedenktafel-datenbank/id-525_metzger.pdf
14;;"Heinrich Runge; Heraldiker; Revolutionsteilnehmer; Berliner Stadtkämmerer";15.12.1817, Zehdenick;26.11.1886, Berlin;10179;Köpenicker Straße;92;Zwischen dem 2. und 3. Fenster rechts vom Eingang;Mitte;19.01.1996;KPM - Berliner Gedenktafel;/ba-mitte/_assets/gedenktafeln/id-14_runge-heinrich.jpg;;;;/kunst-und-kultur-mitte/geschichte/erinnerungskultur/gedenktafel-datenbank/id-14_runge.pdf
16;;"Johann Ernst Gotzkowsky; Unternehmer, Kunsthändler und Begründer der späteren KPM";21.11.1710, Chojnice, Polen;09.08.1775, Berlin;10178;Brüderstraße;13;Links vom Eingang;Mitte;10.05.1996;KPM - Berliner Gedenktafel;/ba-mitte/_assets/gedenktafeln/id-16_johann-georg-gotzkowsky.jpg;;;;/kunst-und-kultur-mitte/geschichte/erinnerungskultur/gedenktafel-datenbank/id-16_gotzkowsky.pdf
17;;"Louis Lewin; Arzt und Pharmakologe; Pionier der Gewerbetoxiologie und Suchtmittelforschung";09.11.1850, Tuchola, Polen;01.12.1929, Berlin;10117;Ziegelstraße;5 bis 9;Zwischen dem 3. und 4. Fenster vom rechts;Mitte;08.11.1996;Bronzetafel;/ba-mitte/_assets/gedenktafeln/id-17_louis-lewin.jpg;;;;/kunst-und-kultur-mitte/geschichte/erinnerungskultur/gedenktafel-datenbank/id-17_louis-lewin.pdf
274;;"Theodor Leipart; Drechsler; Vorsitzender des Allgemeinen Deutschen Gewerkschaftsbundes";17.05.1867, Neubrandenburg;23.03.1947, Berlin;10179;Am Köllnischen Park;2;Links neben dem Haupteingang;Mitte;10.04.1997;Bronzetafel;/ba-mitte/_assets/gedenktafeln/id-274_leipart-theodor.jpg;;;;/kunst-und-kultur-mitte/geschichte/erinnerungskultur/gedenktafel-datenbank/id-274_leipart.pdf
275;;"Eduard Hildebrandt; Maler; Königlich Preußischer Hofmaler";09.09.1817, Danzig;25.10.1868, Berlin;10117;Am Kupfergraben;6a;Zwischen dem 3. und 4. Fenster im 1. Stockwerk;Mitte;;Marmortafel mit vergoldeter Inschrift;/ba-mitte/_assets/gedenktafeln/id-275_eduard-hildebrand.jpg;;;;/kunst-und-kultur-mitte/geschichte/erinnerungskultur/gedenktafel-datenbank/id-275_eduard-hildebrand.pdf
277;;"Emil Frommel; evangelischer Theologe; Schriftsteller; Hofprediger; Militäroberpfarrer";05.01.1828, Karlsruhe;09.11.1898, Plön;10178;Anna-Louisa-Karsch-Straße;9;Hoch über der Haustür;Mitte;;Bronzetafel;/ba-mitte/_assets/gedenktafeln/id-277_frommel-emil.jpg;;;;/kunst-und-kultur-mitte/geschichte/erinnerungskultur/gedenktafel-datenbank/id-277_frommel.pdf
22;;"August Boeckh; Philologe und Altertumsforscher; Universitätsprofessor";24.11.1785, Karlsruhe;03.08.1867, Berlin;10117;Dorotheenstraße;65;Mit Medaillon eines Reliefportraits links vom Eingang;Mitte;24.11.1997;Bronzetafel;/ba-mitte/_assets/gedenktafeln/id-22_boeckh-august.jpg;;;;/kunst-und-kultur-mitte/geschichte/erinnerungskultur/gedenktafel-datenbank/id-22_boeckh-august.pdf
278;;"Ewald Vogt; Maschinenschlosser; Funktionär der KPD; Betriebsrat im Walzwerk Hennigsdorf; NS-Verfolgter";21.08.1905;21.08.1933;10115;Anklamer Straße;5;Zwischen dem 3. und 4. Fenster links vom Eingang;Mitte;1972;Bronzetafel;/ba-mitte/_assets/gedenktafeln/id-278_vogt-ewald.jpg;;;;/kunst-und-kultur-mitte/geschichte/erinnerungskultur/gedenktafel-datenbank/id-278_ewald-vogt.pdf
23;;"Sören Kiekegaard; dänischer Philosoph und Theologe";05.05.1813, Kopenhagen, Dänemark;11.11.1855, Kopenhagen;10117;Jägerstraße;57;Jägerstraße Ecke Charlottenstraße 54, Hausfront zwischen 2 Fenster;Mitte;25.11.1997;Bronzetafel;/ba-mitte/_assets/gedenktafeln/id-23_kierkegaard-soeren.jpg;;;;/kunst-und-kultur-mitte/geschichte/erinnerungskultur/gedenktafel-datenbank/id-23_kierkegaard-soeren.pdf
26;;"Henriette Hirschfeld-Tiburtius; Erste akademisch ausgebildete Zahnärztin in Deutschland";14.02.1834, Westerland auf Sylt;25.08.1911, Berlin;10117;Behrenstraße;9 bis 13;Behrenstraße / Glinkastraße;Mitte;14.02.1998;Edelstahltafel;/ba-mitte/_assets/gedenktafeln/id-26_hirschfeld-tiburtius-henriette.jpg;;;;/kunst-und-kultur-mitte/geschichte/erinnerungskultur/gedenktafel-datenbank/id-26_hirschfeld-tiburtius-henriette.pdf
286;;"Heinrich Heine; Dichter; Schriftsteller und Journalist";13.12.1797, Düsseldorf;17.02.1856, Paris;10117;Behrenstraße;68 bis 71;Zwischen dem 1. und 2. Fenster rechts vom Eingang;Mitte;17.02.1956;Bronzetafel;/ba-mitte/_assets/gedenktafeln/id-286_heinrich-heine.jpg;;;;/kunst-und-kultur-mitte/geschichte/erinnerungskultur/gedenktafel-datenbank/id-286_heine.pdf
291;;"Carl Friedrich Zelter; Maurermeister, Musikprofessor; Komponist; Dirigent";11.12.1758, Berlin;15.05.1832, Berlin;10178;Brüderstraße;13;Ganz links unter 1. Etage;Mitte;1928;Bronzetafel;/ba-mitte/_assets/gedenktafeln/id-291_carl-friedrich-zelter.jpg;;;;/kunst-und-kultur-mitte/geschichte/erinnerungskultur/gedenktafel-datenbank/id-291_zelter.pdf
292;;"Theodor Körner; Dichter und Dramatiker";23.09.1791, Dresden;26.08.1813, Forst Rosenow bei Gadebusch;10178;Brüderstraße;13;2. Tafel links vom Eingang unter 1. Etage;Mitte;1928;Bronzetafel;/ba-mitte/_assets/gedenktafeln/id-292_theodor-koerner.jpg;;;;/kunst-und-kultur-mitte/geschichte/erinnerungskultur/gedenktafel-datenbank/id-292_theodor-koerner.pdf
293;;"Christian Gottfried Körner, Minna Körner und Dora Stock; Schriftsteller";;;10178;Brüderstraße;13;3. Tafel links vom Eingang unter 1. Etage;Mitte;1928;Bronzetafel;/ba-mitte/_assets/gedenktafeln/id-293_koerner-und-stock.jpg;;;;/kunst-und-kultur-mitte/geschichte/erinnerungskultur/gedenktafel-datenbank/id-293_koerner-stock.pdf
38;;"Carl Abraham Gerhard; Mineraloge und Gründer der Berliner Bergakademie";26.02.1738, Lerchenborn;09.03.1821, Berlin;10179;Neue Grünstraße;27;Rechts neben Eingang;Mitte;02.06.1998;Bronzetafel;/ba-mitte/_assets/gedenktafeln/id-38_carl-abraham-gerhard.jpg;;;;/kunst-und-kultur-mitte/geschichte/erinnerungskultur/gedenktafel-datenbank/id-38_gerhard.pdf
294;;"Elisa von der Recke; Christoph August Tiedge; Schriftsteller";"20.05.1754, Schönberg; 14.12.1752, Gardeleben";"13.04.1833, Dresden; 08.03.1841, Dresden";10178;Brüderstraße;13;2. Tafel rechts vom Eingang unter 1. Etage;Mitte;;Bronzetafel;/ba-mitte/_assets/gedenktafeln/id-294_von-der-recke-und-tiedke.jpg;;;;/kunst-und-kultur-mitte/geschichte/erinnerungskultur/gedenktafel-datenbank/id-294_recke-tiedke.pdf
39;;"Karl Philipp Moritz alias Anton Reiser; Schriftsteller, Philosoph und Journalist";15.09.1756, Hameln;26.06.1793, Berlin;10178;Münzstraße;7;Ganz links am Haus;Mitte;15.09.1998;KPM - Berliner Gedenktafel;/ba-mitte/_assets/gedenktafeln/id-39_moritz-karl-philipp.jpg;;;;/kunst-und-kultur-mitte/geschichte/erinnerungskultur/gedenktafel-datenbank/id-39_moritz-karl-philipp.pdf
295;;"Max Butting; Komponist; Gründungsmitglied der Deutschen Akademie der Künste der DDR";06.10.1888, Berlin;13.07.1976, Berlin;10115;Brunnenstraße;148;Über dem Hauseingang;Mitte;;Steintafel mit schwarzer Inschrift;/ba-mitte/_assets/gedenktafeln/id-295_butting-max.jpg;;;;/kunst-und-kultur-mitte/geschichte/erinnerungskultur/gedenktafel-datenbank/id-295_butting.pdf
40;;"Alexander Michailowitsch Gortschakow; russischer Diplomat, Aussenminister und Kanzler";04.06.1798, Haapsalu;13.03.1883, Baden-Baden;10117;Unter den Linden;61;Rechts vom Eingang, Wand zum Gehweg;Mitte;10.11.1998;Bronzetafel;/ba-mitte/_assets/gedenktafeln/id-40_gortschakow.jpg;;;;/kunst-und-kultur-mitte/geschichte/erinnerungskultur/gedenktafel-datenbank/id-40_gortschakov.pdf
296;;"Philipp Schaeffer; Orientalist, Sinologe und NS-Widerstandskämpfer";16.11.1894, Königsberg;13.05.1943, Berlin-Plötzensee;10119;Brunnenstraße;181;1. Obergeschoß rechts von der Treppe;Mitte;1953;Acrylglastafel;/ba-mitte/_assets/gedenktafeln/id-296_schaeffer-philipp.jpg;;;;/kunst-und-kultur-mitte/geschichte/erinnerungskultur/gedenktafel-datenbank/id-296_schaeffer-philipp.pdf
41;;"Peter Behrens; Architekt, Kunstmaler und Designer";14.04.1868, Hamburg;27.02.1940, Berlin;10178;Alexanderplatz;2;Alexanderhaus, zwischen den Eingangstüren;Mitte;02.03.1999;Edelstahltafel;/ba-mitte/_assets/gedenktafeln/id-41_behrens-peter.jpg;;;;/kunst-und-kultur-mitte/geschichte/erinnerungskultur/gedenktafel-datenbank/id-41_behrens-peter.pdf
299;;"August Borsig; Zimmermann; Unternehmer; Gründer der Borsig-Werke";23.06.1804, Breslau;06.07.1854, Berlin;10115;Chausseestraße;1;Rechts vom Eingang;Mitte;;Eisengusstafel;;;;;/kunst-und-kultur-mitte/geschichte/erinnerungskultur/gedenktafel-datenbank/id-299_borsig.pdf
300;;"Bertolt Brecht; Dramatiker und Lyriker; Helene Weigel; Schauspielerin";"10.02.1898, Augsburg; 12.05.1900, Wien";"14.08.1956, Berlin; 06.05.1971, Berlin";10115;Chausseestraße;125;Rechts vom Eingang;Mitte;09.02.1978;Bronzetafel;/ba-mitte/_assets/gedenktafeln/id-300_brecht-weigel.jpg;;;;/kunst-und-kultur-mitte/geschichte/erinnerungskultur/gedenktafel-datenbank/id-300_brecht-weigel.pdf
46;;"Moritz Heinrich Romberg; Neurologe, Armenarzt und Mitbegründer der Neurologie";11.11.1795, Meiningen;17.06.1873, Berlin;10117;Am Zeughaus;2;Links vom Eingang;Mitte;04.06.1999;Bronzetafel;/ba-mitte/_assets/gedenktafeln/id-46_romberg-moritz-heinrich.jpg;;;;/kunst-und-kultur-mitte/geschichte/erinnerungskultur/gedenktafel-datenbank/id-46_romberg-moritz-heinrich.pdf
47;;"Otto Weidt; Unternehmer; Besitzer einer Blindenwerkstatt";02.05.1883, Rostock;22.12.1947, Berlin;10178;Rosenthaler Straße;39;Bodenplatte in der Einfahrt;Mitte;04.09.1999;Bronze-Bodentafel;/ba-mitte/_assets/gedenktafeln/id-47_weidt-otto.jpg;;;;/kunst-und-kultur-mitte/geschichte/erinnerungskultur/gedenktafel-datenbank/id-47_otto-weidt.pdf
303;;"Robert Koch; Mediziner und Mikrobiologe";11.12.1843, Clausthal;27.05.1910, Baden-Baden;10117;Dorotheenstraße;96;Über der Tür des Lesesaales;Mitte;um 1900;Holztafel;;;;;
48;;"Alexander von Humboldt; Naturforscher; Mitbegründer der wissenschaftlichen Geographie";14.09.1769, Berlin;06.05.1859, Berlin;10117;Jägerstraße;22;Zwischen dem 2. und 3. Fenster rechts vom Eingang;Mitte;1984;Bronzetafel;/ba-mitte/_assets/gedenktafeln/id-48_humboldt-alexander-von.jpg;;;;/kunst-und-kultur-mitte/geschichte/erinnerungskultur/gedenktafel-datenbank/id-48_humboldt-alexander.pdf
306;;"Theodor Fontane; Schriftsteller und Apotheker";30.12.1819, Neupuppin;20.09.1898, Berlin;10117;Friedrichstraße;151;Friedrichstraße Ecke Dorotheenstraße, im Schaufenster der Apotheke;Mitte;1992;Glasscheibe mit schwarzer und weißer Schrift;/ba-mitte/_assets/gedenktafeln/id-306_fontane-theodor.jpg;;;;/kunst-und-kultur-mitte/geschichte/erinnerungskultur/gedenktafel-datenbank/id-306_fontane.pdf
51;;"Michail Iwanowitsch Glinka; russischer Komponist";20.05.1804, Smolensk, Russland;03.07.1857, Berlin;10117;Französische Straße;8;Glinkastraße, links vom Eingang;Mitte;18.02.2000;Edelstahltafel;/ba-mitte/_assets/gedenktafeln/id-51_michail-iwanowitsch-glinka.jpg;;;;/kunst-und-kultur-mitte/geschichte/erinnerungskultur/gedenktafel-datenbank/id-51_glinka.pdf
54;;"Ludwig Jonas; protestantischer Theologe; Diakon von St. Nikolai; Kirchenpolitiker";11.02.1797, Neustadt (Dosse);19.09.1859, Berlin;10178;Brüderstraße;13;3. Tafel rechts vom Eingang unter 1. Etage;Mitte;14.09.2000;Bronzetafel;/ba-mitte/_assets/gedenktafeln/id-54_ludwig-jonas.jpg;;;;/kunst-und-kultur-mitte/geschichte/erinnerungskultur/gedenktafel-datenbank/id-54_ludwig-jonas.pdf
56;;"Enrique Gil y Carrasco; spanischer Schriftsteller; Bibliothekar; Botschaftssekretär";15.07.1815, Villafranca del Bierzo;22.02.1846 Berlin;10117;Dorotheenstraße;41;Zwischen 2 Schaufenstern;Mitte;18.10.2000;Bronzetafel mit blauer Inschrift;/ba-mitte/_assets/gedenktafeln/id-56_carrasco-enrique.jpg;;;;/kunst-und-kultur-mitte/geschichte/erinnerungskultur/gedenktafel-datenbank/id-56_carrasco-enrique.pdf
60;;"Robert Frenzel; Schulleiter; Begründer der Berliner Abendrealschule";1888, Berlin;1977, Lüneburg;10119;Gipsstraße;23 a;Links vom Eingang, am Nebeneingang;Mitte;03.03.2001;Bronzetafel;/ba-mitte/_assets/gedenktafeln/id-60_frenzel-robert.jpg;;;;/kunst-und-kultur-mitte/geschichte/erinnerungskultur/gedenktafel-datenbank/id-60_frenzel.pdf
316;;"Michael Iwanowitsch Glinka; russischer Komponist";20.05.1804, Smolensk, Russland;03.07.1857, Berlin;10117;Glinkastraße;9 bis 11;Im geschlossenen Fensterbogen;Mitte;17.03.1952;Steinrelief;/ba-mitte/_assets/gedenktafeln/id-316_glinka-michael-iwanowitsch.jpg;;;;/kunst-und-kultur-mitte/geschichte/erinnerungskultur/gedenktafel-datenbank/id-316_glinka.pdf
61;;"Herbert Baum; Jungkommunist; Leiter der antifaschischen Widerstandsgruppe Herbert Baum";10.02.1912;11.06.1942, Berlin;10178;Am Lustgarten;9;Lustgarten, Gedenkstein vor dem Dom;Mitte;04.03.2001;Gedenksteininschrift und 3 Acrylglastafeln;/ba-mitte/_assets/gedenktafeln/id-61_herbert-baum_1.jpg;/ba-mitte/_assets/gedenktafeln/id-61_herbert-baum_2.jpg;/ba-mitte/_assets/gedenktafeln/id-61_herbert-baum_3.jpg;/ba-mitte/_assets/gedenktafeln/id-61_herbert-baum_4.jpg;/kunst-und-kultur-mitte/geschichte/erinnerungskultur/gedenktafel-datenbank/id-61_herbert-baum.pdf
317;;"Franz Mett; Bergmann, Metallarbeiter, Funktionär der KPD; NS-Widerstandskämpfer (Uhrig-Gruppe)";25.10.1904, Nickelnischken, Ostpreußen;21.08.1944, Zuchthaus Brandenburg;10119;Gormannstraße;13;Am Mittelpfeiler des Eingangs;Mitte;40er Ende;Steintafel;/ba-mitte/_assets/gedenktafeln/id-317_franz-mett.jpg;;;;/kunst-und-kultur-mitte/geschichte/erinnerungskultur/gedenktafel-datenbank/id-317_mett.pdf
573;;"Paul Gurk; Schriftsteller und Maler";26.04.1880, Frankfurt/Oder;12.08.1953, Berlin;13351;Afrikanische Straße;144 b;Rechts vom Eingang;Wedding;;Bronzetafel;/ba-mitte/_assets/gedenktafeln/id-573_gurk-paul.jpg;;;;/kunst-und-kultur-mitte/geschichte/erinnerungskultur/gedenktafel-datenbank/id-573_gurk.pdf
319;;"Franz Bumm; Jurist; Präsident des Reichsgesundheitsamts";07.03.1861, Würzburg;13.08.1942, Berlin;10115;Große Hamburger Straße;7 bis 11;Im Eingangsbereich des Josephshaus St. Hedwig-Krankenhauses;Mitte;14.09.1996;Steintafel mit Reliefportrait;;;;;/kunst-und-kultur-mitte/geschichte/erinnerungskultur/gedenktafel-datenbank/id-319_franz-bumm.pdf
64;;"Regina Jonas; Weltweit erste ordinierte Rabbinerin";03.08.1902, Berlin;1944, Auschwitz-Birkenau;10115;Krausnickstraße;6;Rechts neben dem Eingang;Mitte;01.06.2001;Acrylglastafel;/ba-mitte/_assets/gedenktafeln/id-64_regina-jonas.jpg;;;;/kunst-und-kultur-mitte/geschichte/erinnerungskultur/gedenktafel-datenbank/id-64_regina-jonas.pdf
576;;"Theodor Plievier; Schriftsteller; Matrose; Anarchist";12.02.1892, Berlin;12.03.1955, Avegno, Schweiz;13357;Wiesenstraße;29;Rechts vom Eingang;Gesundbrunnen;;Bronzetafel;/ba-mitte/_assets/gedenktafeln/id-576_plievier-theodor.jpg;;;;/kunst-und-kultur-mitte/geschichte/erinnerungskultur/gedenktafel-datenbank/id-576_plievier.pdf
577;;"Kurt Schumacher; Politiker; Jurist und Redakteur; NS-Verfolgter; SPD-Vorsitzender";13.10.1898, Culm;20.08.1952, Bonn;13353;Müllerstraße;163;Kurt-Schumacher-Haus, links vom Eingang;Wedding;;Bronzetafel;/ba-mitte/_assets/gedenktafeln/id-577_schumacher-kurt.jpg;;;;/kunst-und-kultur-mitte/geschichte/erinnerungskultur/gedenktafel-datenbank/id-577_schumacher.pdf
322;;"Carl Wilhelm Ramler; Dichter und Philosoph der Aufklärung";25.02.1725, Kolberg;11.04.1798, Berlin;10115;Große Hamburger Straße;29 bis 30;An der rechten Seitenkapelle;Mitte;;Schiefertafel;/ba-mitte/_assets/gedenktafeln/id-322_ramler-carl-wilhelm.jpg;;;;/kunst-und-kultur-mitte/geschichte/erinnerungskultur/gedenktafel-datenbank/id-322_ramler.pdf
578;;"Carl Leid; Kommunalpolitiker (SPD); Bezirksbürgermeister von Wedding";02.12.1869, Arnstadt;16.01.1935, Berlin;13351;Carl-Leid-Weg;;Nähe Stadion Rehbergean Wegkreuzung;Wedding;;Bronzetafel am Findling;/ba-mitte/_assets/gedenktafeln/id-578_carl-leid.jpg;;;;/kunst-und-kultur-mitte/geschichte/erinnerungskultur/gedenktafel-datenbank/id-578_leid.pdf
579;;"Wilhelm Hasenclever; Journalist, Schriftsteller und Politiker (ADAV)";19.04.1837, Arnsberg;03.07.1889, Schöneberg;13347;Wilhelm-Hasenclever-Platz;1;Anlage an der Oudenarder Straße /  Seestraße;Wedding;;Bronzetafel;/ba-mitte/_assets/gedenktafeln/id-579_hasenclever-wilhelm.jpg;;;;/kunst-und-kultur-mitte/geschichte/erinnerungskultur/gedenktafel-datenbank/id-579_hasenclever.pdf
580;;"Erwin Schläger; Polizei-Wachtmeister";1907;18.03.1953, Berlin;13355;Graunstraße;37;Links vom Eingang, zwischen dem 2. und 3. Fenster;Gesundbrunnen;;Bronzetafel auf Holztafel;/ba-mitte/_assets/gedenktafeln/id-580_erwin-schlaeger.jpg;;;;/kunst-und-kultur-mitte/geschichte/erinnerungskultur/gedenktafel-datenbank/id-580_schlaeger.pdf
325;;"Christian Ernst Kühze (Kühtze); Theologe";20.01.1744/1745;26.08.1801, Berlin;10115;Sophienstraße;2 bis 3;An der rechten Seite der Sophienkirche;Mitte;;Steintafel;/ba-mitte/_assets/gedenktafeln/id-325_kuehze-ernst.jpg;;;;/kunst-und-kultur-mitte/geschichte/erinnerungskultur/gedenktafel-datenbank/id-325_kuehze.pdf
581;;"Bruno Stephan; Lehrer und Heimatforscher; Gründer des Heimatarchivs Wedding e.V.";09.10.1896;26.08.1983;13353;Müllerstraße;158;Links vom Eingang, zwischen dem 1. und 2. Fenster;Wedding;;Bronzetafel;/ba-mitte/_assets/gedenktafeln/id-581_stephan-bruno.jpg;;;;/kunst-und-kultur-mitte/geschichte/erinnerungskultur/gedenktafel-datenbank/id-581_bruno-stephan.pdf
326;;"Anna Louisa Karsch (Karschin); Dichterin";01.12.1722, Hammer;12.10.1791, Berlin;10115;Große Hamburger Straße;29 bis 30;An der linken Seite der Sophienkirche;Mitte;1802;Steintafel mit vergoldeter Inschrift;/ba-mitte/_assets/gedenktafeln/id-326_karschin-anna-louisa.jpg;;;;/kunst-und-kultur-mitte/geschichte/erinnerungskultur/gedenktafel-datenbank/id-326_karschin.pdf
71;;"Leo Arons; Physiker; Sozialdemokrat und freier Gewerkschafter";15.02.1860, Berlin;10.10.1919, Berlin;10179;Engeldamm;62 bis 64;Rechts vom Eingang;Mitte;06.09.2002;Acrylglastafel;/ba-mitte/_assets/gedenktafeln/id-71_leo-arons.jpg;;;;/kunst-und-kultur-mitte/geschichte/erinnerungskultur/gedenktafel-datenbank/id-71_leo-martin-arons.pdf
327;;"Karl Lohmann (Hans Karl Heinrich Adolf); Biochemiker und Präsident des Instituts für Ernährung der DDR";10.04.1898, Bielefeld;22.04.1978, Berlin;10115;Hessische Straße;3;Linke Hauswand 5. Fenster vom Eingang;Mitte;16.11.1981;Bronzetafel;/ba-mitte/_assets/gedenktafeln/id-327_lohmann-karl.jpg;;;;/kunst-und-kultur-mitte/geschichte/erinnerungskultur/gedenktafel-datenbank/id-327_lohmann.pdf
583;;"Jonny Liesegang (eigtl. Johannes Haasis); Heimatschriftsteller";06.10.1897, Berlin;30.03.1961, Berlin;13351;Afrikanische Straße;146 c;Links vom Eingang;Wedding;16.11.1981;Bronzetafel;/ba-mitte/_assets/gedenktafeln/id-583_liesegang-jonny.jpg;;;;/kunst-und-kultur-mitte/geschichte/erinnerungskultur/gedenktafel-datenbank/id-583_liesegang.pdf
585;;"Kurt Steffelbauer; Lehrer; NS-Widerstandskämper; KPD-Mitglied";16.02.1890, Görlitz;21.05.1942, Berlin-Plötzensee;13353;Tegeler Straße;18;Rechts vom Eingang;Wedding;2008;Bronzetafel;/ba-mitte/_assets/gedenktafeln/id-585_steffelbauer-kurt.jpg;;;;/kunst-und-kultur-mitte/geschichte/erinnerungskultur/gedenktafel-datenbank/id-585_steffelbauer.pdf
